{
  "sourceProductId": null,
  "title": "بگم نگم",
  "titleEn": "BEGAM NAGAM",
  "category": "ارتباط و تعامل",
  "headline": "حرفت را با احترام برسان.",
  "summary": "وب‌اپ فارسی آیتولز برای فرستادن یادآوری یا قدردانی با پیامک؛ با مرور نهایی متن و بدون نمایش هویت فرستنده به گیرنده.",
  "accent": "#83dfce",
  "visual": "chat",
  "tags": ["یادآوری محترمانه", "قدردانی", "پیامک", "فارسی و راست‌به‌چپ"],
  "heroImage": "/images/products/begam-nagam/desktop-reminder-compose.webp",
  "cardImage": "/images/products/begam-nagam/desktop-appreciation-compose.webp",
  "eyebrow": "محصولی از iTools / آیتولز",
  "introTitle": "برای حرف‌هایی که گفتنشان آسان نیست.",
  "intro": "گاهی می‌خواهیم از همراهی کسی تشکر کنیم یا دربارهٔ یک رفتار مشخص، یادآوری کوچکی داشته باشیم؛ اما شروع صحبت آسان نیست. بگم نگم با نمونه‌های موضوعی و مرور متن کامل پیامک، به بیان روشن‌تر این منظور کمک می‌کند. شما متن و شمارهٔ گیرنده را بررسی و درخواست را تأیید می‌کنید. هویت فرستنده به گیرنده نمایش داده نمی‌شود و گفت‌وگوی مستقیمی میان آن‌ها شکل نمی‌گیرد. بررسی متن، تضمین برداشت یکسان یا خوشحال‌شدن گیرنده نیست.",
  "releaseStatus": "وب‌اپ موجود؛ تصاویر از دموی مستقل نسخهٔ ۰٫۱۶٫۱ با داده‌های مصنوعی ثبت شده‌اند.",
  "features": [
    {
      "icon": "layers",
      "title": "یادآوری و قدردانی در یک مسیر روشن",
      "description": "از موضوع‌هایی مثل استفاده از تلفن در جمع یا تشکر از همراهی شروع می‌کنید. هر دو منظور از همان فرم نوشتن، مرور نهایی و تأیید می‌گذرند.",
      "status": "هر دو سناریو در دمو اجرا شدند"
    },
    {
      "icon": "search",
      "title": "نمونه‌هایی برای شروع حرف",
      "description": "دستهٔ مناسب را پیدا می‌کنید و با انتخاب یک نمونه، کادر پیام پر می‌شود. در حالت پیش‌فرضِ بررسی‌شده، متن نهایی از قالب‌های آمادهٔ بررسی‌شده می‌آید؛ بازنویسی دلخواه به فعال‌بودن سرویس جداگانه نیاز دارد.",
      "status": "مسیر متن آماده در دمو بررسی شد"
    },
    {
      "icon": "shield",
      "title": "متن کامل، پیش از تأیید شما",
      "description": "شمارهٔ گیرنده، متن کامل پیامک، راه لغو دریافت و مصرف اعتبار را پیش از ارسال می‌بینید. تغییر شماره به پیش‌نمایش و تأیید تازه نیاز دارد.",
      "status": "پیش‌نمایش و تأیید در دمو بررسی شد"
    },
    {
      "icon": "phone",
      "title": "ورود با تأیید شمارهٔ خودتان",
      "description": "برای ثبت درخواست، شمارهٔ همراه خود را با کد یک‌بارمصرف تأیید می‌کنید. سامانه فرستنده را می‌شناسد؛ پنهان‌بودن شماره از گیرنده به معنی ناشناسی مطلق نیست.",
      "status": "ورود با کد آزمایشی در محیط جدا بررسی شد"
    },
    {
      "icon": "chart",
      "title": "سابقه‌ای برای پیگیری درخواست",
      "description": "در «پیام‌های من»، متن نهایی، شمارهٔ پوشیدهٔ مقصد و وضعیت درخواست را می‌بینید. ثبت در صف، پذیرش سرویس پیامکی و تحویل به گوشی یکسان نیستند؛ خوانده‌شدن پیام گزارش نمی‌شود.",
      "status": "رسید و سابقهٔ شبیه‌سازی‌شده بررسی شد"
    },
    {
      "icon": "shield",
      "title": "اختیار دریافت با گیرنده",
      "description": "گیرنده با لینک داخل پیامک می‌تواند دریافت را متوقف یا پیام را گزارش کند. مدیریت دریافت شمارهٔ خودش از حساب تأییدشده هم ممکن است؛ فعال‌سازی دوباره به تأیید تازهٔ شماره نیاز دارد.",
      "status": "توقف و فعال‌سازی دریافت در دمو بررسی شد"
    },
    {
      "icon": "link",
      "title": "پشتیبانی خصوصی داخل حساب",
      "description": "پس از ورود، پیام متنی خود را برای پشتیبانی ثبت می‌کنید و پاسخ را در همان حساب دنبال می‌کنید. این گفت‌وگو با تیم پشتیبانی است و راه ارتباط با گیرندهٔ پیامک نیست.",
      "status": "ثبت پیام مشتری در دمو بررسی شد"
    },
    {
      "icon": "globe",
      "title": "تجربهٔ فارسی روی موبایل",
      "description": "فرم مرحله‌ای، اعداد فارسی، چیدمان راست‌به‌چپ و تم روشن و تیره، کار با محصول را روی صفحهٔ کوچک همراهی می‌کنند. نماهای موبایل این بسته از اجرای واقعی رابط ثبت شده‌اند.",
      "status": "رابط در عرض‌های ۳۷۵ و ۳۹۰ پیکسل بررسی شد"
    }
  ],
  "gallery": [
    {
      "id": "mobile-home",
      "title": "شروع با یک حرف محترمانه",
      "description": "صفحهٔ اصلی در تم تیرهٔ واقعی محصول؛ نقطهٔ شروع مشترک یادآوری و قدردانی در دموی مستقل.",
      "image": "/images/products/begam-nagam/mobile-home.webp",
      "alt": "صفحهٔ اصلی موبایل بگم نگم در تم تیره، با تصویر نامه و دکمهٔ «بعدی؛ حرفم رو بگم».",
      "visual": "mobile"
    },
    {
      "id": "reminder-draft",
      "title": "انتخاب یک یادآوری خنثی",
      "description": "سناریوی یادآوری، گام اول: انتخاب نمونهٔ «استفاده از تلفن» از دستهٔ «گفت‌وگو و رابطه»؛ متن نمونه در کادر قرار گرفته است.",
      "image": "/images/products/begam-nagam/mobile-reminder-draft.webp",
      "alt": "فرم موبایل با نمونهٔ انتخاب‌شده دربارهٔ کم‌کردن صدای تلفن در جمع، لحن مودبانه و دکمهٔ رفتن به متن نهایی.",
      "visual": "mobile"
    },
    {
      "id": "message-preview",
      "title": "مرور همان متنی که ثبت می‌شود",
      "description": "سناریوی یادآوری، گام دوم: شمارهٔ مصنوعی، متن آمادهٔ بررسی‌شده و تأیید فرستنده کنار هم دیده می‌شوند. دامنهٔ داخل پیام مخصوص دمو و غیرقابل استفاده در اینترنت است.",
      "image": "/images/products/begam-nagam/mobile-reminder-preview.webp",
      "alt": "پیش‌نمایش موبایل یادآوری استفاده از تلفن، با شمارهٔ مصنوعی، لینک نمایشی demo.invalid، مصرف یک هدیه و دکمهٔ ارسال آزمایشی.",
      "visual": "mobile"
    },
    {
      "id": "demo-receipt",
      "title": "رسید ثبت آزمایشی",
      "description": "سناریوی یادآوری، گام سوم: برنامه ثبت آزمایشی درخواست را اعلام می‌کند و راه پیگیری در «پیام‌های من» را نشان می‌دهد. این تصویر شاهد ارسال واقعی نیست.",
      "image": "/images/products/begam-nagam/mobile-reminder-receipt.webp",
      "alt": "رسید موبایل با نشان تأیید، عبارت «درخواست آزمایشی ثبت شد» و دکمهٔ «پیام‌های من».",
      "visual": "mobile"
    },
    {
      "id": "appreciation-preview",
      "title": "همین مسیر، برای قدردانی",
      "description": "سناریوی دوم: متن آمادهٔ تشکر از مهربانی و همراهی، پیش از تأیید نهایی مرور می‌شود. شماره و لینک متعلق به محیط مصنوعی‌اند.",
      "image": "/images/products/begam-nagam/mobile-appreciation-preview.webp",
      "alt": "پیش‌نمایش موبایل پیام قدردانی، با برچسب متن آمادهٔ بررسی‌شده، شمارهٔ مصنوعی و تأیید پیش از ارسال آزمایشی.",
      "visual": "mobile"
    },
    {
      "id": "message-history",
      "title": "نتیجهٔ هر دو درخواست در سابقه",
      "description": "قدردانی و یادآوریِ همین دو سناریو با شماره‌های پوشیده و برچسب «ارسال شبیه‌سازی شد · آزمایشی» در سابقه دیده می‌شوند.",
      "image": "/images/products/begam-nagam/desktop-history.webp",
      "alt": "صفحهٔ دسکتاپ پیام‌های من با دو پیام مصنوعی قدردانی و یادآوری، وضعیت ارسال شبیه‌سازی‌شده و ماندهٔ یک هدیه.",
      "visual": "dashboard"
    },
    {
      "id": "recipient-preferences",
      "title": "توقف دریافت برای شمارهٔ خودتان",
      "description": "در حساب مصنوعی گیرنده، دریافت پیام متوقف شده است. این انتخاب برای همهٔ فرستنده‌ها اعمال می‌شود و هویت هیچ فرستنده‌ای را نشان نمی‌دهد.",
      "image": "/images/products/begam-nagam/mobile-recipient-preferences.webp",
      "alt": "صفحهٔ موبایل تنظیم دریافت با عنوان «حقت هست که نشنوی»، وضعیت توقف دریافت و دکمهٔ فعال‌سازی دوباره.",
      "visual": "mobile"
    },
    {
      "id": "demo-pricing",
      "title": "هدیه و بسته‌های اعتبار",
      "description": "فهرست واقعی بسته‌های پایگاه آزمایشی نسخهٔ بررسی‌شده؛ مبالغ تصویر، تعرفهٔ تأییدشدهٔ امروزِ سرویس عملیاتی محسوب نمی‌شوند و خرید واقعی در این بررسی انجام نشده است.",
      "image": "/images/products/begam-nagam/desktop-pricing.webp",
      "alt": "تعرفه‌های دسکتاپ در دمو با سه هدیهٔ اولیه و بسته‌های ۳، ۹، ۳۰ و ۹۰ پیامی؛ قیمت‌های نمایشی به تومان هستند.",
      "visual": "dashboard"
    }
  ],
  "signature": [
    {
      "layout": "spotlight",
      "eyebrow": "شروع از یک منظور مشخص",
      "title": "یک یادآوری کوچک، یا یک تشکر ساده.",
      "description": "نمونه‌های موضوعی به شما کمک می‌کنند از یک موقعیت روشن شروع کنید. انتخاب قدردانی یا یادآوری، نقطهٔ شروع متن را عوض می‌کند؛ اختیار مرور و تأیید نهایی با شما می‌ماند.",
      "bullets": ["دسته‌هایی برای حال خوب، رابطه، خانه و محیط کار", "قرارگرفتن نمونهٔ انتخاب‌شده در کادر پیام", "قالب‌های بررسی‌شده در حالت پیش‌فرض", "فعال‌سازی جداگانه برای بازنویسی متن دلخواه"],
      "image": "/images/products/begam-nagam/mobile-reminder-draft.webp",
      "alt": "انتخاب نمونهٔ یادآوری استفاده از تلفن در فرم واقعی موبایل؛ مسیر پیش‌فرض متن آماده.",
      "visual": "mobile"
    },
    {
      "layout": "reverse",
      "eyebrow": "دو انتخاب مستقل",
      "title": "شما متن را تأیید می‌کنید؛ گیرنده دربارهٔ دریافت تصمیم می‌گیرد.",
      "description": "پیش از ثبت، متن کامل و مقصد را مرور می‌کنید. پس از آن، گیرنده برای ادامهٔ دریافت پیام‌ها اختیار دارد. پنهان‌بودن هویت فرستنده این حق را از او نمی‌گیرد.",
      "bullets": ["نمایش متن کامل پیامک پیش از تأیید", "پیش‌نمایش تازه پس از تغییر شمارهٔ مقصد", "توقف دریافت یا گزارش از لینک پیامک", "فعال‌سازی دوباره با تأیید تازهٔ شمارهٔ گیرنده"],
      "image": "/images/products/begam-nagam/mobile-recipient-preferences.webp",
      "alt": "وضعیت توقف دریافت در حساب مصنوعی گیرنده و امکان فعال‌سازی دوباره با تأیید شماره.",
      "visual": "mobile"
    },
    {
      "layout": "spotlight",
      "eyebrow": "پیگیری با معنای روشن",
      "title": "رسید درخواست، وعدهٔ خوانده‌شدن نیست.",
      "description": "سابقهٔ پیام‌ها کمک می‌کند نتیجهٔ ثبت و پردازش را دنبال کنید. وضعیت نامعلوم باید بررسی شود و دلیلی برای ثبت دوبارهٔ همان پیام نیست. در این تصاویر، نتیجهٔ ارسال به‌صراحت آزمایشی است.",
      "bullets": ["شمارهٔ مقصد در سابقه پوشیده نمایش داده می‌شود", "متن نهایی هر درخواست در دسترس فرستنده است", "ثبت، پذیرش و تحویل وضعیت‌های متفاوت‌اند", "خوانده‌شدن پیامک گزارش نمی‌شود"],
      "image": "/images/products/begam-nagam/desktop-history.webp",
      "alt": "سابقهٔ دو سناریوی مصنوعی با برچسب ارسال شبیه‌سازی‌شده و بدون ادعای خوانده‌شدن.",
      "visual": "dashboard"
    }
  ],
  "modules": [],
  "integrations": [
    {"name": "کاوه‌نگار", "status": "اجرای واقعی OTP و پیامک در سوابق پروژه ثبت شده؛ در دموی این بسته هیچ پیامک واقعی ارسال نشده است."},
    {"name": "GapGPT", "status": "بازنویسی و بازبینی اختیاری؛ اجرای محدود واقعی در سوابق ثبت شده و در دموی معرفی غیرفعال است."},